[
  {
    "id": "brk_001",
    "broker": "zerodha",
    "label": "Primary Trading Account",
    "clientId": "AB1234",
    "enabled": true,
    "session": {
      "status": "active",
      "loggedInAt": "2026-09-21T03:00:00Z",
      "expiresAt": "2026-09-21T18:30:00Z"
    },
    "createdAt": "2026-01-10T00:00:00Z"
  },
  {
    "id": "brk_002",
    "broker": "zerodha",
    "label": "Secondary Algorithmic Account",
    "clientId": "CD5678",
    "enabled": true,
    "session": {
      "status": "expired",
      "loggedInAt": "2026-09-20T03:00:00Z",
      "expiresAt": "2026-09-20T18:30:00Z"
    },
    "createdAt": "2026-02-15T00:00:00Z"
  },
  {
    "id": "brk_003",
    "broker": "zerodha",
    "label": "Backup Execution Account",
    "clientId": "EF9012",
    "enabled": false,
    "session": {
      "status": "not_logged_in",
      "loggedInAt": null,
      "expiresAt": null
    },
    "createdAt": "2026-05-01T00:00:00Z"
  }
]
